{
  "$schema": "https://json-schema.org/draft/2020-12/schema",
  "type": "object",
  "additionalProperties": false,
  "required": ["$schema", "schemaVersion", "contractId", "behaviorFiles", "presentationFiles"],
  "properties": {
    "$schema": {
      "const": "assessment-contract.schema.json"
    },
    "schemaVersion": {
      "const": 1
    },
    "contractId": {
      "type": "string",
      "pattern": "^[a-z][a-z0-9-]*-v[1-9][0-9]*$"
    },
    "behaviorFiles": {
      "type": "array",
      "minItems": 1,
      "uniqueItems": true,
      "items": {
        "type": "string",
        "minLength": 1,
        "pattern": "^[A-Za-z0-9._/-]+$"
      }
    },
    "presentationFiles": {
      "type": "array",
      "minItems": 1,
      "uniqueItems": true,
      "items": {
        "type": "string",
        "minLength": 1,
        "pattern": "^[A-Za-z0-9._/-]+$"
      }
    }
  }
}
