{
  "$schema": "assessment-contract.schema.json",
  "schemaVersion": 1,
  "contractId": "source-assessment-v4",
  "behaviorFiles": [
    "hosted_copilot/copilot-rule-catalog/instruction-catalog.schema.json",
    "hosted_copilot/copilot-rule-catalog/parser-contracts/parser-contract.schema.json",
    "hosted_copilot/copilot-rule-catalog/rule-assessments/assessment-contract.schema.json",
    "hosted_copilot/copilot-rule-catalog/rule-assessments/source-assessment-baseline-v4.schema.json",
    "hosted_copilot/copilot-rule-catalog/rule-assessments/source-assessment-draft.schema.json",
    "hosted_copilot/copilot-rule-catalog/source-definitions/source-definition-set.json",
    "hosted_copilot/copilot-rule-catalog/source-definitions/source-definition-set.schema.json",
    "hosted_copilot/copilot-rule-catalog/source-definitions/source-definition.schema.json",
    "hosted_copilot/copilot-rule-catalog/source-inventories/source-inventory.schema.json",
    "hosted_copilot/tools/assessment-prompts/SourceAssessment-v4.md",
    "hosted_copilot/tools/internal/assessment/Invoke-SourceAssessment.ps1",
    "hosted_copilot/tools/internal/assessment/New-SourceAssessmentBaseline.ps1",
    "hosted_copilot/tools/modules/shared/HostedToolkit.Helpers.psm1",
    "hosted_copilot/tools/modules/shared/HostedCli.psm1",
    "hosted_copilot/tools/modules/shared/SourceEvidenceValidation.psm1"
  ],
  "presentationFiles": [
    "hosted_copilot/tools/modules/assessment/SourceAssessmentPresentation.psm1"
  ]
}
